{
  "artifactAppendix": "paper/artifact-appendix.md",
  "claimRegistry": "paper/claims-and-evidence.md",
  "contentHash": "sha256:7a2597b47d77ffa98c6f29ad2655dee27009c7db7c20c71a206efec454607c3b",
  "files": [
    {
      "path": "paper/README.md",
      "sha256": "sha256:0f0ee185495235aaf6d058390b71c1664eed4590c685890cb4fd51e8ad2b0105"
    },
    {
      "path": "paper/manuscript.md",
      "sha256": "sha256:70c8f16e0e5406d8114367060b6e96f3f97a8d14a1a96e90600374535a435e60"
    },
    {
      "path": "paper/claims-and-evidence.md",
      "sha256": "sha256:e1b0d001b30295a3071c60e1a9c0fb38318cd1f06c6040b64316d1cfe1bc5657"
    },
    {
      "path": "paper/limitations.md",
      "sha256": "sha256:552f187af22b0a43840d6dbc469a34d2d45a3a16abc05d61a1d0b75272964c6b"
    },
    {
      "path": "paper/artifact-appendix.md",
      "sha256": "sha256:08ea02aa60a9613eb47feb20593e4de56a59b6e22663673ccae81c410b0349fd"
    },
    {
      "path": "paper/reproduce-paper.sh",
      "sha256": "sha256:5934d7b3a60608d52defb6cce3cb9645a36f23425f5cfffd5b28edbc1e28eef6"
    }
  ],
  "limitations": "paper/limitations.md",
  "manuscript": "paper/manuscript.md",
  "paperIssue": 388,
  "primaryResearchQuestion": "Can a target-free symbolic system form executable reusable rules from self-generated search observations and evaluate formation, validation, counterexamples, project-internal novelty, proof strength, held-out utility, and reproducibility as separate fail-closed evidence axes?",
  "requiredEvidence": [
    {
      "issue": 383,
      "purpose": "candidate-independent preregistered discovery benchmark",
      "status": "PENDING"
    },
    {
      "issue": 235,
      "purpose": "information-parity baselines and ablations",
      "status": "PENDING"
    },
    {
      "issue": 384,
      "purpose": "end-to-end discovery cost and amortized utility",
      "status": "PENDING"
    },
    {
      "issue": 385,
      "purpose": "authoritative capability and claim status",
      "status": "PENDING"
    },
    {
      "issue": 387,
      "purpose": "independently executable reproduction artifact",
      "status": "PENDING"
    },
    {
      "issue": 389,
      "purpose": "optional empirical interestingness study",
      "status": "OPTIONAL"
    }
  ],
  "schema": "regelsuche.paper-artifact-manifest/v1",
  "status": "FOUNDATION"
}
